{
  "po_number": "PO-2026-0224-2715",
  "retailer_name": "Bike Depot",
  "order_date": "2026-02-24",
  "order_total": 21647.20,
  "customer_name": "Betty Phillips",
  "special_requests": "",
  "order_items": [
    {
      "sku": "AB-EL-038",
      "product_name": "Durable Monitor",
      "description": "Durable Monitor",
      "quantity": 4,
      "unit_price": 106.81,
      "line_total": 427.24,
      "option_color": "ti2345",
      "option_size": "",
      "option_weight": "",
      "option_battery": "",
      "option_range": "",
      "option_speed": "",
      "option_wheel_size": "",
      "option_brake_type": "",
      "option_certification": ""
    },
    {
      "sku": "AB-MB-055",
      "product_name": "Trail Pro",
      "description": "Trail Pro",
      "quantity": 4,
      "unit_price": 1661.78,
      "line_total": 6647.12,
      "option_color": "sv3456",
      "option_size": "S",
      "option_weight": "22.3 lbs",
      "option_battery": "",
      "option_range": "",
      "option_speed": "",
      "option_wheel_size": "",
      "option_brake_type": "",
      "option_certification": ""
    },
    {
      "sku": "AB-WH-002",
      "product_name": "Precision Tire",
      "description": "Precision Tire",
      "quantity": 8,
      "unit_price": 220.90,
      "line_total": 1767.20,
      "option_color": "cr4321",
      "option_size": "",
      "option_weight": "",
      "option_battery": "",
      "option_range": "",
      "option_speed": "",
      "option_wheel_size": "26\"",
      "option_brake_type": "",
      "option_certification": ""
    },
    {
      "sku": "AB-GR-018",
      "product_name": "Heavy-Duty Chainring",
      "description": "Heavy-Duty Chainring",
      "quantity": 8,
      "unit_price": 515.10,
      "line_total": 4120.80,
      "option_color": "rd7298",
      "option_size": "",
      "option_weight": "",
      "option_battery": "",
      "option_range": "",
      "option_speed": "8",
      "option_wheel_size": "",
      "option_brake_type": "",
      "option_certification": ""
    },
    {
      "sku": "AB-KB-031",
      "product_name": "Beginner Classic",
      "description": "Beginner Classic",
      "quantity": 6,
      "unit_price": 301.28,
      "line_total": 1807.68,
      "option_color": "bl4567",
      "option_size": "",
      "option_weight": "",
      "option_battery": "",
      "option_range": "",
      "option_speed": "",
      "option_wheel_size": "",
      "option_brake_type": "",
      "option_certification": ""
    },
    {
      "sku": "AB-AC-062",
      "product_name": "Advanced Lock",
      "description": "Advanced Lock",
      "quantity": 7,
      "unit_price": 136.60,
      "line_total": 956.20,
      "option_color": "fg3456",
      "option_size": "",
      "option_weight": "",
      "option_battery": "",
      "option_range": "",
      "option_speed": "",
      "option_wheel_size": "",
      "option_brake_type": "",
      "option_certification": ""
    },
    {
      "sku": "AB-EB-077",
      "product_name": "E-Glide Sport",
      "description": "E-Glide Sport",
      "quantity": 2,
      "unit_price": 1324.06,
      "line_total": 2648.12,
      "option_color": "ti2345",
      "option_size": "L",
      "option_weight": "32.0 lbs",
      "option_battery": "36V 10Ah",
      "option_range": "37 miles",
      "option_speed": "",
      "option_wheel_size": "",
      "option_brake_type": "",
      "option_certification": ""
    },
    {
      "sku": "AB-RB-027",
      "product_name": "Aero Classic",
      "description": "Aero Classic",
      "quantity": 1,
      "unit_price": 813.39,
      "line_total": 813.39,
      "option_color": "br7654",
      "option_size": "S",
      "option_weight": "30.6 lbs",
      "option_battery": "",
      "option_range": "",
      "option_speed": "",
      "option_wheel_size": "",
      "option_brake_type": "",
      "option_certification": ""
    },
    {
      "sku": "AB-MT-005",
      "product_name": "Lightweight Tool",
      "description": "Lightweight Tool",
      "quantity": 7,
      "unit_price": 64.45,
      "line_total": 451.15,
      "option_color": "",
      "option_size": "",
      "option_weight": "",
      "option_battery": "",
      "option_range": "",
      "option_speed": "",
      "option_wheel_size": "",
      "option_brake_type": "",
      "option_certification": ""
    },
    {
      "sku": "AB-RB-003",
      "product_name": "Speedster Elite",
      "description": "Speedster Elite",
      "quantity": 1,
      "unit_price": 2008.30,
      "line_total": 2008.30,
      "option_color": "wh9001",
      "option_size": "L",
      "option_weight": "31.9 lbs",
      "option_battery": "",
      "option_range": "",
      "option_speed": "",
      "option_wheel_size": "",
      "option_brake_type": "",
      "option_certification": ""
    }
  ]
}