{
  "po_number": "PO-2026-0224-0119",
  "retailer_name": "Cycle City",
  "order_date": "2026-02-24",
  "order_total": 11095.97,
  "customer_name": "Donna Phillips",
  "special_requests": "",
  "order_items": [
    {
      "sku": "AB-AC-039",
      "product_name": "Heavy-Duty Pump",
      "description": "Heavy-Duty Pump",
      "quantity": 7,
      "unit_price": 137.48,
      "line_total": 962.36,
      "option_color": "gr5432",
      "option_size": "",
      "option_weight": "",
      "option_battery": "",
      "option_range": "",
      "option_speed": "",
      "option_wheel_size": "",
      "option_brake_type": "",
      "option_certification": ""
    },
    {
      "sku": "AB-WH-001",
      "product_name": "Precision Tube",
      "description": "Precision Tube",
      "quantity": 2,
      "unit_price": 420.10,
      "line_total": 840.20,
      "option_color": "rd7298",
      "option_size": "",
      "option_weight": "",
      "option_battery": "",
      "option_range": "",
      "option_speed": "",
      "option_wheel_size": "27.5\"",
      "option_brake_type": "",
      "option_certification": ""
    },
    {
      "sku": "AB-MB-060",
      "product_name": "Alpine Elite",
      "description": "Alpine Elite",
      "quantity": 4,
      "unit_price": 911.37,
      "line_total": 3645.48,
      "option_color": "bk1798",
      "option_size": "M",
      "option_weight": "23.2 lbs",
      "option_battery": "",
      "option_range": "",
      "option_speed": "",
      "option_wheel_size": "",
      "option_brake_type": "",
      "option_certification": ""
    },
    {
      "sku": "AB-CP-016",
      "product_name": "Durable Component",
      "description": "Durable Component",
      "quantity": 5,
      "unit_price": 111.41,
      "line_total": 557.05,
      "option_color": "wh9001",
      "option_size": "",
      "option_weight": "",
      "option_battery": "",
      "option_range": "",
      "option_speed": "",
      "option_wheel_size": "",
      "option_brake_type": "",
      "option_certification": ""
    },
    {
      "sku": "AB-RB-067",
      "product_name": "Sprint Classic",
      "description": "Sprint Classic",
      "quantity": 8,
      "unit_price": 636.36,
      "line_total": 5090.88,
      "option_color": "rd7298",
      "option_size": "XS",
      "option_weight": "32.4 lbs",
      "option_battery": "",
      "option_range": "",
      "option_speed": "",
      "option_wheel_size": "",
      "option_brake_type": "",
      "option_certification": ""
    }
  ]
}