{
  "po_number": "PO-2026-0224-8026",
  "retailer_name": "Bike Haven",
  "order_date": "2026-02-24",
  "order_total": 38994.01,
  "customer_name": "Helen Phillips",
  "special_requests": "",
  "order_items": [
    {
      "sku": "AB-EL-032",
      "product_name": "High-Performance GPS",
      "description": "High-Performance GPS",
      "quantity": 1,
      "unit_price": 545.85,
      "line_total": 545.85,
      "option_color": "bl4567",
      "option_size": "",
      "option_weight": "",
      "option_battery": "",
      "option_range": "",
      "option_speed": "",
      "option_wheel_size": "",
      "option_brake_type": "",
      "option_certification": ""
    },
    {
      "sku": "AB-EB-066",
      "product_name": "E-Drive Master",
      "description": "E-Drive Master",
      "quantity": 3,
      "unit_price": 3821.92,
      "line_total": 11465.76,
      "option_color": "or8901",
      "option_size": "L",
      "option_weight": "18.3 lbs",
      "option_battery": "36V 12Ah",
      "option_range": "53 miles",
      "option_speed": "",
      "option_wheel_size": "",
      "option_brake_type": "",
      "option_certification": ""
    },
    {
      "sku": "AB-SB-025",
      "product_name": "Cyclocross Sport",
      "description": "Cyclocross Sport",
      "quantity": 8,
      "unit_price": 1960.01,
      "line_total": 15680.08,
      "option_color": "cr4321",
      "option_size": "L",
      "option_weight": "",
      "option_battery": "",
      "option_range": "",
      "option_speed": "",
      "option_wheel_size": "",
      "option_brake_type": "",
      "option_certification": ""
    },
    {
      "sku": "AB-HB-063",
      "product_name": "Handlebar Sport",
      "description": "Handlebar Sport",
      "quantity": 4,
      "unit_price": 37.11,
      "line_total": 148.44,
      "option_color": "ol4567",
      "option_size": "L",
      "option_weight": "16.9 lbs",
      "option_battery": "",
      "option_range": "",
      "option_speed": "",
      "option_wheel_size": "",
      "option_brake_type": "",
      "option_certification": ""
    },
    {
      "sku": "AB-MB-028",
      "product_name": "Summit Master",
      "description": "Summit Master",
      "quantity": 6,
      "unit_price": 1858.98,
      "line_total": 11153.88,
      "option_color": "gy6789",
      "option_size": "S",
      "option_weight": "33.1 lbs",
      "option_battery": "",
      "option_range": "",
      "option_speed": "",
      "option_wheel_size": "",
      "option_brake_type": "",
      "option_certification": ""
    }
  ]
}