{
  "po_number": "PO-2026-0224-4135",
  "retailer_name": "Pedal Power",
  "order_date": "2026-02-24",
  "order_total": 14632.08,
  "customer_name": "Donna Robinson",
  "special_requests": "",
  "order_items": [
    {
      "sku": "AB-WH-004",
      "product_name": "Durable Rim",
      "description": "Durable Rim",
      "quantity": 8,
      "unit_price": 307.61,
      "line_total": 2460.88,
      "option_color": "rd7298",
      "option_size": "",
      "option_weight": "",
      "option_battery": "",
      "option_range": "",
      "option_speed": "",
      "option_wheel_size": "700c",
      "option_brake_type": "",
      "option_certification": ""
    },
    {
      "sku": "AB-EB-036",
      "product_name": "E-Boost Classic",
      "description": "E-Boost Classic",
      "quantity": 3,
      "unit_price": 1789.16,
      "line_total": 5367.48,
      "option_color": "br7654",
      "option_size": "XS",
      "option_weight": "32.4 lbs",
      "option_battery": "48V 17.5Ah",
      "option_range": "56 miles",
      "option_speed": "",
      "option_wheel_size": "",
      "option_brake_type": "",
      "option_certification": ""
    },
    {
      "sku": "AB-RB-034",
      "product_name": "Swift Classic",
      "description": "Swift Classic",
      "quantity": 3,
      "unit_price": 2130.59,
      "line_total": 6391.77,
      "option_color": "cr4321",
      "option_size": "M",
      "option_weight": "31.4 lbs",
      "option_battery": "",
      "option_range": "",
      "option_speed": "",
      "option_wheel_size": "",
      "option_brake_type": "",
      "option_certification": ""
    },
    {
      "sku": "AB-AC-015",
      "product_name": "Lightweight Bottle",
      "description": "Lightweight Bottle",
      "quantity": 7,
      "unit_price": 58.85,
      "line_total": 411.95,
      "option_color": "rd7298",
      "option_size": "",
      "option_weight": "",
      "option_battery": "",
      "option_range": "",
      "option_speed": "",
      "option_wheel_size": "",
      "option_brake_type": "",
      "option_certification": ""
    }
  ]
}