{
  "po_number": "PO-2026-0224-6001",
  "retailer_name": "Bike Emporium",
  "order_date": "2026-02-24",
  "order_total": 22477.94,
  "customer_name": "Carol Jones",
  "special_requests": "",
  "order_items": [
    {
      "sku": "AB-CH-025",
      "product_name": "Advanced Drive",
      "description": "Advanced Drive",
      "quantity": 1,
      "unit_price": 122.48,
      "line_total": 122.48,
      "option_color": "",
      "option_size": "",
      "option_weight": "",
      "option_battery": "",
      "option_range": "",
      "option_speed": "",
      "option_wheel_size": "",
      "option_brake_type": "",
      "option_certification": ""
    },
    {
      "sku": "AB-WH-010",
      "product_name": "Durable Hub",
      "description": "Durable Hub",
      "quantity": 8,
      "unit_price": 180.37,
      "line_total": 1442.96,
      "option_color": "or8901",
      "option_size": "",
      "option_weight": "",
      "option_battery": "",
      "option_range": "",
      "option_speed": "",
      "option_wheel_size": "26\"",
      "option_brake_type": "",
      "option_certification": ""
    },
    {
      "sku": "AB-KB-022",
      "product_name": "Mini Elite",
      "description": "Mini Elite",
      "quantity": 6,
      "unit_price": 331.95,
      "line_total": 1991.70,
      "option_color": "cb8901",
      "option_size": "",
      "option_weight": "",
      "option_battery": "",
      "option_range": "",
      "option_speed": "",
      "option_wheel_size": "",
      "option_brake_type": "",
      "option_certification": ""
    },
    {
      "sku": "AB-BR-034",
      "product_name": "Durable Stopper",
      "description": "Durable Stopper",
      "quantity": 4,
      "unit_price": 275.54,
      "line_total": 1102.16,
      "option_color": "wh9001",
      "option_size": "",
      "option_weight": "",
      "option_battery": "",
      "option_range": "",
      "option_speed": "",
      "option_wheel_size": "",
      "option_brake_type": "disc",
      "option_certification": ""
    },
    {
      "sku": "AB-SB-003",
      "product_name": "Touring Elite",
      "description": "Touring Elite",
      "quantity": 7,
      "unit_price": 2545.52,
      "line_total": 17818.64,
      "option_color": "ti2345",
      "option_size": "XS",
      "option_weight": "",
      "option_battery": "",
      "option_range": "",
      "option_speed": "",
      "option_wheel_size": "",
      "option_brake_type": "",
      "option_certification": ""
    }
  ]
}