{
  "po_number": "PO-2026-0224-5839",
  "retailer_name": "Urban Cycles",
  "order_date": "2026-02-24",
  "order_total": 5427.05,
  "customer_name": "Sarah Rodriguez",
  "special_requests": "",
  "order_items": [
    {
      "sku": "AB-RB-009",
      "product_name": "Lightning Deluxe",
      "description": "Lightning Deluxe",
      "quantity": 3,
      "unit_price": 652.34,
      "line_total": 1957.02,
      "option_color": "br7654",
      "option_size": "XL",
      "option_weight": "21.8 lbs",
      "option_battery": "",
      "option_range": "",
      "option_speed": "",
      "option_wheel_size": "",
      "option_brake_type": "",
      "option_certification": ""
    },
    {
      "sku": "AB-BR-036",
      "product_name": "Lightweight Disc",
      "description": "Lightweight Disc",
      "quantity": 8,
      "unit_price": 204.36,
      "line_total": 1634.88,
      "option_color": "yl5678",
      "option_size": "",
      "option_weight": "",
      "option_battery": "",
      "option_range": "",
      "option_speed": "",
      "option_wheel_size": "",
      "option_brake_type": "disc",
      "option_certification": ""
    },
    {
      "sku": "AB-PD-011",
      "product_name": "Lightweight Platform",
      "description": "Lightweight Platform",
      "quantity": 7,
      "unit_price": 82.71,
      "line_total": 578.97,
      "option_color": "fg3456",
      "option_size": "",
      "option_weight": "",
      "option_battery": "",
      "option_range": "",
      "option_speed": "",
      "option_wheel_size": "",
      "option_brake_type": "",
      "option_certification": ""
    },
    {
      "sku": "AB-GR-026",
      "product_name": "Precision Cassette",
      "description": "Precision Cassette",
      "quantity": 2,
      "unit_price": 628.09,
      "line_total": 1256.18,
      "option_color": "or8901",
      "option_size": "",
      "option_weight": "",
      "option_battery": "",
      "option_range": "",
      "option_speed": "24",
      "option_wheel_size": "",
      "option_brake_type": "",
      "option_certification": ""
    }
  ]
}