{
  "po_number": "PO-2026-0224-0124",
  "retailer_name": "Cycle Central",
  "order_date": "2026-02-24",
  "order_total": 55382.70,
  "customer_name": "John Taylor",
  "special_requests": "",
  "order_items": [
    {
      "sku": "AB-SB-023",
      "product_name": "BMX Deluxe",
      "description": "BMX Deluxe",
      "quantity": 3,
      "unit_price": 1037.33,
      "line_total": 3111.99,
      "option_color": "or8901",
      "option_size": "XS",
      "option_weight": "",
      "option_battery": "",
      "option_range": "",
      "option_speed": "",
      "option_wheel_size": "",
      "option_brake_type": "",
      "option_certification": ""
    },
    {
      "sku": "AB-RB-060",
      "product_name": "Speedster Master",
      "description": "Speedster Master",
      "quantity": 5,
      "unit_price": 1522.70,
      "line_total": 7613.50,
      "option_color": "gy6789",
      "option_size": "L",
      "option_weight": "23.2 lbs",
      "option_battery": "",
      "option_range": "",
      "option_speed": "",
      "option_wheel_size": "",
      "option_brake_type": "",
      "option_certification": ""
    },
    {
      "sku": "AB-EB-057",
      "product_name": "E-Ride Sport",
      "description": "E-Ride Sport",
      "quantity": 6,
      "unit_price": 3255.26,
      "line_total": 19531.56,
      "option_color": "wh9001",
      "option_size": "L",
      "option_weight": "23.3 lbs",
      "option_battery": "48V 14Ah",
      "option_range": "38 miles",
      "option_speed": "",
      "option_wheel_size": "",
      "option_brake_type": "",
      "option_certification": ""
    },
    {
      "sku": "AB-SB-040",
      "product_name": "Cyclocross Deluxe",
      "description": "Cyclocross Deluxe",
      "quantity": 5,
      "unit_price": 5025.13,
      "line_total": 25125.65,
      "option_color": "wh9001",
      "option_size": "L",
      "option_weight": "",
      "option_battery": "",
      "option_range": "",
      "option_speed": "",
      "option_wheel_size": "",
      "option_brake_type": "",
      "option_certification": ""
    }
  ]
}