{
  "po_number": "PO-2026-0224-4485",
  "retailer_name": "Trail Riders",
  "order_date": "2026-02-24",
  "order_total": 50667.16,
  "customer_name": "Joshua Green",
  "special_requests": "",
  "order_items": [
    {
      "sku": "AB-EB-075",
      "product_name": "E-Flow Elite",
      "description": "E-Flow Elite",
      "quantity": 6,
      "unit_price": 2837.05,
      "line_total": 17022.30,
      "option_color": "gr5432",
      "option_size": "XS",
      "option_weight": "17.0 lbs",
      "option_battery": "48V 17.5Ah",
      "option_range": "35 miles",
      "option_speed": "",
      "option_wheel_size": "",
      "option_brake_type": "",
      "option_certification": ""
    },
    {
      "sku": "AB-KB-032",
      "product_name": "Tiny Elite",
      "description": "Tiny Elite",
      "quantity": 2,
      "unit_price": 664.65,
      "line_total": 1329.30,
      "option_color": "bl4567",
      "option_size": "",
      "option_weight": "",
      "option_battery": "",
      "option_range": "",
      "option_speed": "",
      "option_wheel_size": "",
      "option_brake_type": "",
      "option_certification": ""
    },
    {
      "sku": "AB-EB-054",
      "product_name": "E-Ride Pro",
      "description": "E-Ride Pro",
      "quantity": 4,
      "unit_price": 4612.95,
      "line_total": 18451.80,
      "option_color": "wh9001",
      "option_size": "XS",
      "option_weight": "23.2 lbs",
      "option_battery": "36V 12Ah",
      "option_range": "41 miles",
      "option_speed": "",
      "option_wheel_size": "",
      "option_brake_type": "",
      "option_certification": ""
    },
    {
      "sku": "AB-HB-044",
      "product_name": "Handlebar Master",
      "description": "Handlebar Master",
      "quantity": 1,
      "unit_price": 118.09,
      "line_total": 118.09,
      "option_color": "sv3456",
      "option_size": "L",
      "option_weight": "20.4 lbs",
      "option_battery": "",
      "option_range": "",
      "option_speed": "",
      "option_wheel_size": "",
      "option_brake_type": "",
      "option_certification": ""
    },
    {
      "sku": "AB-RB-075",
      "product_name": "Aero Master",
      "description": "Aero Master",
      "quantity": 4,
      "unit_price": 776.82,
      "line_total": 3107.28,
      "option_color": "cr4321",
      "option_size": "XS",
      "option_weight": "29.9 lbs",
      "option_battery": "",
      "option_range": "",
      "option_speed": "",
      "option_wheel_size": "",
      "option_brake_type": "",
      "option_certification": ""
    },
    {
      "sku": "AB-MB-044",
      "product_name": "Peak Sport",
      "description": "Peak Sport",
      "quantity": 1,
      "unit_price": 1793.54,
      "line_total": 1793.54,
      "option_color": "bl4567",
      "option_size": "XS",
      "option_weight": "33.0 lbs",
      "option_battery": "",
      "option_range": "",
      "option_speed": "",
      "option_wheel_size": "",
      "option_brake_type": "",
      "option_certification": ""
    },
    {
      "sku": "AB-GR-013",
      "product_name": "Precision Derailleur",
      "description": "Precision Derailleur",
      "quantity": 5,
      "unit_price": 162.59,
      "line_total": 812.95,
      "option_color": "cr4321",
      "option_size": "",
      "option_weight": "",
      "option_battery": "",
      "option_range": "",
      "option_speed": "7",
      "option_wheel_size": "",
      "option_brake_type": "",
      "option_certification": ""
    },
    {
      "sku": "AB-EB-049",
      "product_name": "E-Ride Deluxe",
      "description": "E-Ride Deluxe",
      "quantity": 3,
      "unit_price": 2255.93,
      "line_total": 6767.79,
      "option_color": "bk1798",
      "option_size": "M",
      "option_weight": "30.7 lbs",
      "option_battery": "48V 14Ah",
      "option_range": "29 miles",
      "option_speed": "",
      "option_wheel_size": "",
      "option_brake_type": "",
      "option_certification": ""
    },
    {
      "sku": "AB-CP-014",
      "product_name": "Heavy-Duty Kit",
      "description": "Heavy-Duty Kit",
      "quantity": 3,
      "unit_price": 421.37,
      "line_total": 1264.11,
      "option_color": "ol4567",
      "option_size": "",
      "option_weight": "",
      "option_battery": "",
      "option_range": "",
      "option_speed": "",
      "option_wheel_size": "",
      "option_brake_type": "",
      "option_certification": ""
    }
  ]
}