{
  "po_number": "PO-2026-0224-7702",
  "retailer_name": "Wheels & More",
  "order_date": "2026-02-24",
  "order_total": 14713.97,
  "customer_name": "Ronald Nguyen",
  "special_requests": "",
  "order_items": [
    {
      "sku": "AB-FR-034",
      "product_name": "Durable Chassis",
      "description": "Durable Chassis",
      "quantity": 8,
      "unit_price": 979.50,
      "line_total": 7836.00,
      "option_color": "ti2345",
      "option_size": "XS",
      "option_weight": "29.4 lbs",
      "option_battery": "",
      "option_range": "",
      "option_speed": "",
      "option_wheel_size": "",
      "option_brake_type": "",
      "option_certification": ""
    },
    {
      "sku": "AB-KB-001",
      "product_name": "Little Deluxe",
      "description": "Little Deluxe",
      "quantity": 7,
      "unit_price": 700.06,
      "line_total": 4900.42,
      "option_color": "yl5678",
      "option_size": "",
      "option_weight": "",
      "option_battery": "",
      "option_range": "",
      "option_speed": "",
      "option_wheel_size": "",
      "option_brake_type": "",
      "option_certification": ""
    },
    {
      "sku": "AB-MT-005",
      "product_name": "Lightweight Tool",
      "description": "Lightweight Tool",
      "quantity": 2,
      "unit_price": 64.45,
      "line_total": 128.90,
      "option_color": "",
      "option_size": "",
      "option_weight": "",
      "option_battery": "",
      "option_range": "",
      "option_speed": "",
      "option_wheel_size": "",
      "option_brake_type": "",
      "option_certification": ""
    },
    {
      "sku": "AB-CP-007",
      "product_name": "Heavy-Duty Component",
      "description": "Heavy-Duty Component",
      "quantity": 5,
      "unit_price": 369.73,
      "line_total": 1848.65,
      "option_color": "br7654",
      "option_size": "",
      "option_weight": "",
      "option_battery": "",
      "option_range": "",
      "option_speed": "",
      "option_wheel_size": "",
      "option_brake_type": "",
      "option_certification": ""
    }
  ]
}