{
  "po_number": "PO-2026-0224-1901",
  "retailer_name": "Speed Shop",
  "order_date": "2026-02-24",
  "order_total": 26272.41,
  "customer_name": "William Moore",
  "special_requests": "",
  "order_items": [
    {
      "sku": "AB-MB-071",
      "product_name": "Canyon Sport",
      "description": "Canyon Sport",
      "quantity": 6,
      "unit_price": 1716.95,
      "line_total": 10301.70,
      "option_color": "ti2345",
      "option_size": "M",
      "option_weight": "24.3 lbs",
      "option_battery": "",
      "option_range": "",
      "option_speed": "",
      "option_wheel_size": "",
      "option_brake_type": "",
      "option_certification": ""
    },
    {
      "sku": "AB-ST-012",
      "product_name": "High-Performance Seat",
      "description": "High-Performance Seat",
      "quantity": 2,
      "unit_price": 181.59,
      "line_total": 363.18,
      "option_color": "or8901",
      "option_size": "",
      "option_weight": "",
      "option_battery": "",
      "option_range": "",
      "option_speed": "",
      "option_wheel_size": "",
      "option_brake_type": "",
      "option_certification": ""
    },
    {
      "sku": "AB-EB-076",
      "product_name": "E-Drive Sport",
      "description": "E-Drive Sport",
      "quantity": 1,
      "unit_price": 6342.08,
      "line_total": 6342.08,
      "option_color": "ti2345",
      "option_size": "L",
      "option_weight": "16.3 lbs",
      "option_battery": "48V 17.5Ah",
      "option_range": "30 miles",
      "option_speed": "",
      "option_wheel_size": "",
      "option_brake_type": "",
      "option_certification": ""
    },
    {
      "sku": "AB-CH-039",
      "product_name": "High-Performance Drive",
      "description": "High-Performance Drive",
      "quantity": 3,
      "unit_price": 19.56,
      "line_total": 58.68,
      "option_color": "",
      "option_size": "",
      "option_weight": "",
      "option_battery": "",
      "option_range": "",
      "option_speed": "",
      "option_wheel_size": "",
      "option_brake_type": "",
      "option_certification": ""
    },
    {
      "sku": "AB-MT-004",
      "product_name": "Durable Tool",
      "description": "Durable Tool",
      "quantity": 1,
      "unit_price": 55.32,
      "line_total": 55.32,
      "option_color": "",
      "option_size": "",
      "option_weight": "",
      "option_battery": "",
      "option_range": "",
      "option_speed": "",
      "option_wheel_size": "",
      "option_brake_type": "",
      "option_certification": ""
    },
    {
      "sku": "AB-SF-023",
      "product_name": "High-Performance Vest",
      "description": "High-Performance Vest",
      "quantity": 5,
      "unit_price": 58.40,
      "line_total": 292.00,
      "option_color": "sv3456",
      "option_size": "",
      "option_weight": "",
      "option_battery": "",
      "option_range": "",
      "option_speed": "",
      "option_wheel_size": "",
      "option_brake_type": "",
      "option_certification": ""
    },
    {
      "sku": "AB-EB-079",
      "product_name": "E-Force Classic",
      "description": "E-Force Classic",
      "quantity": 3,
      "unit_price": 2953.15,
      "line_total": 8859.45,
      "option_color": "sv3456",
      "option_size": "M",
      "option_weight": "34.3 lbs",
      "option_battery": "48V 14Ah",
      "option_range": "47 miles",
      "option_speed": "",
      "option_wheel_size": "",
      "option_brake_type": "",
      "option_certification": ""
    }
  ]
}