{
  "po_number": "PO-2026-0224-7969",
  "retailer_name": "City Bikes Plus",
  "order_date": "2026-02-24",
  "order_total": 66129.79,
  "customer_name": "Jeffrey Evans",
  "special_requests": "",
  "order_items": [
    {
      "sku": "AB-MB-051",
      "product_name": "Alpine Deluxe",
      "description": "Alpine Deluxe",
      "quantity": 4,
      "unit_price": 764.47,
      "line_total": 3057.88,
      "option_color": "gr5432",
      "option_size": "M",
      "option_weight": "18.2 lbs",
      "option_battery": "",
      "option_range": "",
      "option_speed": "",
      "option_wheel_size": "",
      "option_brake_type": "",
      "option_certification": ""
    },
    {
      "sku": "AB-EB-045",
      "product_name": "E-Drive Pro",
      "description": "E-Drive Pro",
      "quantity": 6,
      "unit_price": 4819.41,
      "line_total": 28916.46,
      "option_color": "br7654",
      "option_size": "M",
      "option_weight": "31.8 lbs",
      "option_battery": "48V 14Ah",
      "option_range": "34 miles",
      "option_speed": "",
      "option_wheel_size": "",
      "option_brake_type": "",
      "option_certification": ""
    },
    {
      "sku": "AB-FR-019",
      "product_name": "Durable Base",
      "description": "Durable Base",
      "quantity": 5,
      "unit_price": 281.91,
      "line_total": 1409.55,
      "option_color": "bl4567",
      "option_size": "XS",
      "option_weight": "19.1 lbs",
      "option_battery": "",
      "option_range": "",
      "option_speed": "",
      "option_wheel_size": "",
      "option_brake_type": "",
      "option_certification": ""
    },
    {
      "sku": "AB-HB-008",
      "product_name": "Bar Sport",
      "description": "Bar Sport",
      "quantity": 5,
      "unit_price": 43.14,
      "line_total": 215.70,
      "option_color": "bl4567",
      "option_size": "L",
      "option_weight": "24.2 lbs",
      "option_battery": "",
      "option_range": "",
      "option_speed": "",
      "option_wheel_size": "",
      "option_brake_type": "",
      "option_certification": ""
    },
    {
      "sku": "AB-MB-073",
      "product_name": "Terrain Master",
      "description": "Terrain Master",
      "quantity": 7,
      "unit_price": 3372.52,
      "line_total": 23607.64,
      "option_color": "cr4321",
      "option_size": "XL",
      "option_weight": "23.9 lbs",
      "option_battery": "",
      "option_range": "",
      "option_speed": "",
      "option_wheel_size": "",
      "option_brake_type": "",
      "option_certification": ""
    },
    {
      "sku": "AB-EB-061",
      "product_name": "E-Drive Sport",
      "description": "E-Drive Sport",
      "quantity": 3,
      "unit_price": 2391.02,
      "line_total": 7173.06,
      "option_color": "br7654",
      "option_size": "XL",
      "option_weight": "18.9 lbs",
      "option_battery": "36V 12Ah",
      "option_range": "59 miles",
      "option_speed": "",
      "option_wheel_size": "",
      "option_brake_type": "",
      "option_certification": ""
    },
    {
      "sku": "AB-MB-022",
      "product_name": "Trail Classic",
      "description": "Trail Classic",
      "quantity": 2,
      "unit_price": 848.96,
      "line_total": 1697.92,
      "option_color": "sv3456",
      "option_size": "S",
      "option_weight": "23.8 lbs",
      "option_battery": "",
      "option_range": "",
      "option_speed": "",
      "option_wheel_size": "",
      "option_brake_type": "",
      "option_certification": ""
    },
    {
      "sku": "AB-MT-029",
      "product_name": "Precision Cleaner",
      "description": "Precision Cleaner",
      "quantity": 2,
      "unit_price": 25.79,
      "line_total": 51.58,
      "option_color": "",
      "option_size": "",
      "option_weight": "",
      "option_battery": "",
      "option_range": "",
      "option_speed": "",
      "option_wheel_size": "",
      "option_brake_type": "",
      "option_certification": ""
    }
  ]
}