{
  "po_number": "PO-2026-0224-4497",
  "retailer_name": "Two Wheel Store",
  "order_date": "2026-02-24",
  "order_total": 37972.01,
  "customer_name": "Jessica Hernandez",
  "special_requests": "",
  "order_items": [
    {
      "sku": "AB-EB-014",
      "product_name": "E-Power Elite",
      "description": "E-Power Elite",
      "quantity": 3,
      "unit_price": 2025.11,
      "line_total": 6075.33,
      "option_color": "bl4567",
      "option_size": "M",
      "option_weight": "31.5 lbs",
      "option_battery": "48V 14Ah",
      "option_range": "48 miles",
      "option_speed": "",
      "option_wheel_size": "",
      "option_brake_type": "",
      "option_certification": ""
    },
    {
      "sku": "AB-SF-036",
      "product_name": "Advanced Guard",
      "description": "Advanced Guard",
      "quantity": 6,
      "unit_price": 75.54,
      "line_total": 453.24,
      "option_color": "br7654",
      "option_size": "",
      "option_weight": "",
      "option_battery": "",
      "option_range": "",
      "option_speed": "",
      "option_wheel_size": "",
      "option_brake_type": "",
      "option_certification": ""
    },
    {
      "sku": "AB-CH-014",
      "product_name": "Heavy-Duty Link",
      "description": "Heavy-Duty Link",
      "quantity": 4,
      "unit_price": 33.46,
      "line_total": 133.84,
      "option_color": "",
      "option_size": "",
      "option_weight": "",
      "option_battery": "",
      "option_range": "",
      "option_speed": "",
      "option_wheel_size": "",
      "option_brake_type": "",
      "option_certification": ""
    },
    {
      "sku": "AB-RB-040",
      "product_name": "Lightning Classic",
      "description": "Lightning Classic",
      "quantity": 8,
      "unit_price": 3913.70,
      "line_total": 31309.60,
      "option_color": "gy6789",
      "option_size": "S",
      "option_weight": "20.5 lbs",
      "option_battery": "",
      "option_range": "",
      "option_speed": "",
      "option_wheel_size": "",
      "option_brake_type": "",
      "option_certification": ""
    }
  ]
}